{
  "$schema": "../schemas/hydrant_set.schema.json",
  "schemaVersion": 1,
  "notes": [
    "Комплект на один пожарный кран; обозначения стандартов — по действующим ГОСТ Р на изделия, сверить с выбранным производителем."
  ],
  "barrel": { "50": "РС-50", "65": "РС-70" },
  "items": [
    { "name": "Клапан пожарный запорный угловой DN{dn}", "designation": "ГОСТ Р 53278-2009", "unit": "шт.", "perHydrant": 1 },
    { "name": "Головка соединительная цапковая ГЦ-{dn}", "designation": "ГОСТ Р 53279-2009", "unit": "шт.", "perHydrant": 1 },
    { "name": "Рукав пожарный напорный DN{dn}, длина {hose} м, с головками ГР-{dn}", "designation": "ГОСТ Р 51049-2019", "unit": "шт.", "perHydrant": 1 },
    { "name": "Ствол пожарный ручной {barrel}, спрыск {nozzle} мм", "designation": "ГОСТ Р 53331-2009", "unit": "шт.", "perHydrant": 1 },
    { "name": "Шкаф пожарный для одного пожарного крана", "designation": "ГОСТ Р 51844-2009", "unit": "шт.", "perHydrant": 1 }
  ]
}
